narrationId,spaceAboveInVh,spaceBelowInVh,h2Text,paragraphText,hRef,hRefText,trigger
0,40,40,Section II,Scroll down to fade the graph in,,,unhide
1,40,40,Some data,This is really important,,,one
2,40,40,No Really,This wiggly graph tells us it's really important,,,two
3,40,40,It's baaad,And the graph wiggles really show how bad it is,,,three
4,40,40,And it's getting worse,More wiggles,,,four
5,40,100,in closing,"We have no idea what to do about it, so now the graph will fade out",,,hide
6,50,50,The end,,https://www.drugabuse.gov/drugs-abuse/opioids/opioid-overdose-crisis,What can I do to help?,opacityzero
