narrationId,spaceAboveInVh,spaceBelowInVh,h2Text,paragraphText,hRef,hRefText,trigger1,40,40,EXAMPLE SECTION WITH CHART,Scroll down to fade the graph in,,,opacityzero2,40,40,Triggering Graph Actions,Here we're triggering an empty graph,,,unhide2,40,40,No data,Trigger with no data,,,series1:0-02,40,40,Some data,This is really important,,,series1:95-053,40,40,Some other data,This wiggly graph tells us it's really important,,,series2:95-056,40,40,,,,,hide7,50,50,The end,,https://stash.ihme.washington.edu/projects/VIZ/repos/scrolly-teller/browse,Here's a link to the scrolly-teller repo,opacityzero